{
  "$schema": "http://json-schema.org/draft-07/schema#",
  "title": "Sirdar Triage Note",
  "type": "object",
  "additionalProperties": false,
  "required": [
    "ticket",
    "title",
    "complaint",
    "complaintOriginal",
    "customerReplyDraft",
    "timeline",
    "reproSteps",
    "reproduction",
    "rootCause",
    "blastRadius",
    "classification",
    "proposedFix",
    "openQuestions"
  ],
  "properties": {
    "ticket": {
      "type": "object",
      "additionalProperties": false,
      "required": [
        "key",
        "title",
        "trackerUrl",
        "helpdeskId",
        "helpdeskUrl",
        "priority",
        "service",
        "customer",
        "customerId",
        "customerIds"
      ],
      "properties": {
        "key": { "type": "string" },
        "title": { "type": "string" },
        "trackerUrl": { "type": "string" },
        "helpdeskId": { "type": "string" },
        "helpdeskUrl": { "type": "string" },
        "priority": { "type": "string" },
        "service": { "type": "string" },
        "customer": {
          "type": "string",
          "description": "The customer's name exactly as the bundle's Customer line gives it, verbatim. Do not append a domain, CompanyID, or company code — those go in customerIds."
        },
        "customerId": { "type": "string" },
        "customerIds": {
          "type": ["array", "null"],
          "items": { "type": "string" },
          "description": "Any customer identifiers beyond customerId that appear in the bundle or that you resolved yourself — domain, company code, account number — one string per identifier. Never append these to customer. Null when there are none."
        }
      }
    },
    "title": { "type": "string" },
    "complaint": { "type": "string" },
    "complaintOriginal": {
      "type": ["string", "null"],
      "description": "Null when the complaint was already written in the note's language."
    },
    "customerReplyDraft": {
      "anyOf": [
        {
          "type": "object",
          "additionalProperties": false,
          "required": ["language", "text"],
          "properties": {
            "language": { "type": "string", "minLength": 2 },
            "text": { "type": "string" }
          }
        },
        { "type": "null" }
      ]
    },
    "timeline": {

      "type": "array",
      "items": {
        "type": "object",
        "additionalProperties": false,
        "required": ["at", "role", "summary"],
        "properties": {
          "at": { "type": "string" },
          "role": { "type": "string" },
          "summary": { "type": "string" }
        }
      }
    },
    "reproSteps": {
      "type": "array",
      "items": { "type": "string" }
    },
    "reproduction": {
      "anyOf": [
        {
          "type": "object",
          "additionalProperties": false,
          "required": ["attempted", "outcome", "where", "steps", "evidence"],
          "properties": {
            "attempted": { "type": "boolean" },
            "outcome": {
              "type": "string",
              "enum": ["reproduced", "not_reproduced", "not_attempted"]
            },
            "where": { "type": ["string", "null"] },
            "steps": { "type": "array", "items": { "type": "string" } },
            "evidence": { "type": "array", "items": { "type": "string" } }
          }
        },
        { "type": "null" }
      ]
    },
    "rootCause": {
      "type": "object",
      "additionalProperties": false,
      "required": ["hypothesis", "confidence", "evidence", "codeRefs"],
      "properties": {
        "hypothesis": { "type": "string" },
        "confidence": {
          "type": "string",
          "enum": ["high", "medium", "low", "unknown"]
        },
        "evidence": {
          "type": "array",
          "items": {
            "type": "object",
            "additionalProperties": false,
            "required": ["source", "query", "finding"],
            "properties": {
              "source": { "type": "string" },
              "query": { "type": "string" },
              "finding": { "type": "string" }
            }
          }
        },
        "codeRefs": {
          "type": "array",
          "items": { "type": "string" }
        }
      }
    },
    "blastRadius": { "type": "string" },
    "classification": {
      "type": "string",
      "enum": ["code", "data", "config", "not-a-bug", "unknown"]
    },
    "proposedFix": {
      "type": "object",
      "additionalProperties": false,
      "required": ["description", "files", "remediationSql", "risks"],
      "properties": {
        "description": { "type": "string" },
        "files": {
          "type": "array",
          "items": { "type": "string" }
        },
        "remediationSql": { "type": "string" },
        "risks": { "type": "string" }
      }
    },
    "openQuestions": {
      "type": "array",
      "items": { "type": "string" }
    }
  }
}
