{
  "ticket": {
    "key": "OMNI-1",
    "title": "Export fails for large orders",
    "trackerUrl": "https://tracker.example/OMNI-1",
    "helpdeskId": "12345",
    "helpdeskUrl": "https://helpdesk.example/12345",
    "priority": "high",
    "service": "omni",
    "customer": "Example Corp",
    "customerId": "cust-1",
    "customerIds": null
  },
  "title": "Sample issue for template checks",
  "complaint": "Customer reports the export fails for orders over 500 lines.",
  "complaintOriginal": "التصدير لا يعمل عندما يحتوي الطلب على أكثر من ٥٠٠ بند. الملف ينزل فارغًا.",
  "timeline": [
    { "at": "2026-09-01T10:00:00Z", "role": "customer", "summary": "Reported the export failing." },
    { "at": "2026-09-01T10:15:00Z", "role": "L1", "summary": "Confirmed the failure and escalated." }
  ],
  "reproSteps": [
    "Create an order with 500+ line items.",
    "Request a CSV export.",
    "Observe the export job fail."
  ],
  "rootCause": {
    "hypothesis": "The export job times out serializing more than 500 rows.",
    "confidence": "medium",
    "evidence": [
      { "source": "logs", "query": "service:export level:error", "finding": "Timeout after 30s on large exports." }
    ],
    "codeRefs": ["internal/export/csv.go:42"]
  },
  "blastRadius": "Any customer exporting an order with more than 500 line items.",
  "classification": "code",
  "proposedFix": {
    "description": "Stream the export instead of buffering it in memory.",
    "files": ["internal/export/csv.go"],
    "remediationSql": "",
    "risks": "Streaming changes the export's error-handling path."
  },
  "openQuestions": [
    "Is 500 lines the exact threshold, or does it vary by column count?"
  ],
  "reproduction": {
    "attempted": true,
    "outcome": "reproduced",
    "where": "https://staging.oxo.example (tenant dama)",
    "steps": ["Open invoices"],
    "evidence": ["screenshot shots/1.png"]
  },
  "customerReplyDraft": {
    "language": "ar",
    "text": "شكرًا لتواصلكم. تم تحويل البلاغ إلى الفريق الهندسي ونحن ننظر في المشكلة الآن. سنوافيكم بأي مستجد فور توفره."
  }
}
